[{"poemId":"KHS-MIXED-0001","canonicalId":"KHS-CANON-CHWON-CHUYAUJUNG","title":{"zh":"秋夜雨中","ko":"추야우중"},"author":{"authorId":"KAUTH-CHOE-CHIWON","zh":"崔致遠","ko":"최치원"},"era":{"label":"신라 말","startYear":857,"endYear":null,"confidence":"high"},"genre":{"broad":"한시","form":"오언절구"},"sourceWork":{"collectionTitle":"위키문헌 개별 작품","juan":null,"entryTitle":"秋夜雨中","sourceUrl":"https://ko.wikisource.org/wiki/%EC%B6%94%EC%95%BC%EC%9A%B0%EC%A4%91","sourcePolicyId":"SRC-WIKISOURCE-TEXT"},"text":{"poemZh":"秋風唯苦吟\n世路少知音\n窓外三更雨\n燈前萬里心","poemKoReading":"추풍유고음\n세로소지음\n창외삼경우\n등전만리심","poemKoGloss":null},"legacyAssets":{"translationKo":"가을바람에 괴로이 읊으니\n세상에 나를 알 이 적구나.\n창밖에는 밤비 내리는데\n등 앞 외로운 맘 만 리를 달리네.","notes":[],"commentaryKo":null},"ownedAssets":{"translationKoOwned":null,"notesOwned":[],"commentaryKoOwned":"타향과 향수의 정조가 응축된 절구다.","ownedContentMeta":{"status":"mixed-test","editedBy":"태훈","reviewedBy":null,"approvedBy":null,"updatedAt":"2026-04-20 17:35","researchBacked":true,"needsHumanReview":true,"generationPolicy":"manual-mixed-batch","sourceRefs":["https://ko.wikisource.org/wiki/%EC%B6%94%EC%95%BC%EC%9A%B0%EC%A4%91"],"rightsReview":{"legacyTranslationInjectedToModel":false,"legacyNotesInjectedToModel":false,"similarityCheckPassed":true,"copyrightRiskLevel":"low","commercialSafe":true,"commercialSafeReason":"wikisource translation page"}}},"rights":{"legacyTranslation":{"exists":true,"sourcePolicyId":"SRC-WIKISOURCE-TEXT","sourceUrl":"https://ko.wikisource.org/wiki/%EC%B6%94%EC%95%BC%EC%9A%B0%EC%A4%91","copyrightStatus":"licensed","usageClass":"commercial_allowed","publicDisplayAllowedNow":true,"commercialAllowedNow":true,"requiresPermissionForCommercial":false,"mustReplaceBeforeCommercial":false,"replacementPriority":"low","attributionRequired":true,"checkedAt":"2026-04-20T17:35:00+09:00","checkedBy":"태훈","evidence":"페이지 하단 CC BY-SA 표기 확인","notes":"위키문헌 수록 현대어 번역"},"originalText":{"exists":true,"sourcePolicyId":"SRC-WIKISOURCE-TEXT","sourceUrl":"https://ko.wikisource.org/wiki/%EC%B6%94%EC%95%BC%EC%9A%B0%EC%A4%91","copyrightStatus":"licensed","usageClass":"commercial_allowed","publicDisplayAllowedNow":true,"commercialAllowedNow":true,"requiresPermissionForCommercial":false,"mustReplaceBeforeCommercial":false,"replacementPriority":"low","attributionRequired":true,"checkedAt":null,"checkedBy":null,"evidence":null,"notes":null},"legacyNotes":{"exists":false,"sourcePolicyId":null,"sourceUrl":null,"copyrightStatus":"unknown","usageClass":"not_applicable","publicDisplayAllowedNow":false,"commercialAllowedNow":false,"requiresPermissionForCommercial":false,"mustReplaceBeforeCommercial":false,"replacementPriority":"low","attributionRequired":false,"checkedAt":null,"checkedBy":null,"evidence":null,"notes":null},"ownedTranslation":{"exists":false,"sourcePolicyId":null,"sourceUrl":null,"copyrightStatus":"unknown","usageClass":"not_applicable","publicDisplayAllowedNow":false,"commercialAllowedNow":false,"requiresPermissionForCommercial":false,"mustReplaceBeforeCommercial":false,"replacementPriority":"low","attributionRequired":false,"checkedAt":null,"checkedBy":null,"evidence":null,"notes":null},"ownedNotes":{"exists":true,"sourcePolicyId":null,"sourceUrl":null,"copyrightStatus":"owned","usageClass":"commercial_allowed","publicDisplayAllowedNow":true,"commercialAllowedNow":true,"requiresPermissionForCommercial":false,"mustReplaceBeforeCommercial":false,"replacementPriority":"low","attributionRequired":false,"checkedAt":null,"checkedBy":null,"evidence":null,"notes":null},"images":{"exists":false,"sourcePolicyId":null,"sourceUrl":null,"copyrightStatus":"unknown","usageClass":"not_applicable","publicDisplayAllowedNow":false,"commercialAllowedNow":false,"requiresPermissionForCommercial":false,"mustReplaceBeforeCommercial":false,"replacementPriority":"low","attributionRequired":false,"checkedAt":null,"checkedBy":null,"evidence":null,"notes":null}},"commercialTransition":{"isCommercialReady":true,"blockingAssets":[],"replacementRequired":[]}},{"poemId":"KHS-MIXED-0002","canonicalId":"KHS-CANON-JJS-SONGIN","title":{"zh":"送人","ko":"송인"},"author":{"authorId":"KAUTH-JEONG-JISANG","zh":"鄭知常","ko":"정지상"},"era":{"label":"고려 중기","startYear":null,"endYear":1135,"confidence":"medium"},"genre":{"broad":"한시","form":"칠언절구"},"sourceWork":{"collectionTitle":"위키문헌 개별 작품","juan":null,"entryTitle":"送人-大同江","sourceUrl":"https://ko.wikisource.org/wiki/%EC%86%A1%EC%9D%B8","sourcePolicyId":"SRC-WIKISOURCE-TEXT"},"text":{"poemZh":"雨歇長堤草色多\n送君南浦動悲歌\n大同江水何時盡\n別淚年年添綠波","poemKoReading":"우헐장제초색다\n송군남포동비가\n대동강수하시진\n별루년년첨록파","poemKoGloss":null},"legacyAssets":{"translationKo":"비 갠 긴 둑에는 풀빛이 짙은데\n그대 보내는 남포엔 슬픈 노래 울리네\n대동강 물이야 어느 때 마를 건가\n해마다 이별 눈물 푸른 강물에 더하네","notes":[],"commentaryKo":null},"ownedAssets":{"translationKoOwned":null,"notesOwned":[],"commentaryKoOwned":"대동강의 물결과 이별의 눈물을 겹쳐 놓는 구성으로 널리 사랑받는 작품이다.","ownedContentMeta":{"status":"mixed-test","editedBy":"태훈","reviewedBy":null,"approvedBy":null,"updatedAt":"2026-04-20 17:35","researchBacked":true,"needsHumanReview":true,"generationPolicy":"manual-mixed-batch","sourceRefs":["https://ko.wikisource.org/wiki/%EC%86%A1%EC%9D%B8"],"rightsReview":{"legacyTranslationInjectedToModel":false,"legacyNotesInjectedToModel":false,"similarityCheckPassed":true,"copyrightRiskLevel":"low","commercialSafe":true,"commercialSafeReason":"wikisource translation page"}}},"rights":{"legacyTranslation":{"exists":true,"sourcePolicyId":"SRC-WIKISOURCE-TEXT","sourceUrl":"https://ko.wikisource.org/wiki/%EC%86%A1%EC%9D%B8","copyrightStatus":"licensed","usageClass":"commercial_allowed","publicDisplayAllowedNow":true,"commercialAllowedNow":true,"requiresPermissionForCommercial":false,"mustReplaceBeforeCommercial":false,"replacementPriority":"low","attributionRequired":true,"checkedAt":"2026-04-20T17:35:00+09:00","checkedBy":"태훈","evidence":"페이지 하단 CC BY-SA 표기 확인","notes":"위키문헌 수록 현대어 번역"},"originalText":{"exists":true,"sourcePolicyId":"SRC-WIKISOURCE-TEXT","sourceUrl":"https://ko.wikisource.org/wiki/%EC%86%A1%EC%9D%B8","copyrightStatus":"licensed","usageClass":"commercial_allowed","publicDisplayAllowedNow":true,"commercialAllowedNow":true,"requiresPermissionForCommercial":false,"mustReplaceBeforeCommercial":false,"replacementPriority":"low","attributionRequired":true,"checkedAt":null,"checkedBy":null,"evidence":null,"notes":null},"legacyNotes":{"exists":false,"sourcePolicyId":null,"sourceUrl":null,"copyrightStatus":"unknown","usageClass":"not_applicable","publicDisplayAllowedNow":false,"commercialAllowedNow":false,"requiresPermissionForCommercial":false,"mustReplaceBeforeCommercial":false,"replacementPriority":"low","attributionRequired":false,"checkedAt":null,"checkedBy":null,"evidence":null,"notes":null},"ownedTranslation":{"exists":false,"sourcePolicyId":null,"sourceUrl":null,"copyrightStatus":"unknown","usageClass":"not_applicable","publicDisplayAllowedNow":false,"commercialAllowedNow":false,"requiresPermissionForCommercial":false,"mustReplaceBeforeCommercial":false,"replacementPriority":"low","attributionRequired":false,"checkedAt":null,"checkedBy":null,"evidence":null,"notes":null},"ownedNotes":{"exists":true,"sourcePolicyId":null,"sourceUrl":null,"copyrightStatus":"owned","usageClass":"commercial_allowed","publicDisplayAllowedNow":true,"commercialAllowedNow":true,"requiresPermissionForCommercial":false,"mustReplaceBeforeCommercial":false,"replacementPriority":"low","attributionRequired":false,"checkedAt":null,"checkedBy":null,"evidence":null,"notes":null},"images":{"exists":false,"sourcePolicyId":null,"sourceUrl":null,"copyrightStatus":"unknown","usageClass":"not_applicable","publicDisplayAllowedNow":false,"commercialAllowedNow":false,"requiresPermissionForCommercial":false,"mustReplaceBeforeCommercial":false,"replacementPriority":"low","attributionRequired":false,"checkedAt":null,"checkedBy":null,"evidence":null,"notes":null}},"commercialTransition":{"isCommercialReady":true,"blockingAssets":[],"replacementRequired":[]}},{"poemId":"KHS-MIXED-0003","canonicalId":"KHS-CANON-IGYUBO-GANGSANGHYOUU","title":{"zh":"江上曉雨","ko":"강상효우"},"author":{"authorId":"KAUTH-LEE-GYUBO","zh":"李奎報","ko":"이규보"},"era":{"label":"고려 중기","startYear":1168,"endYear":1241,"confidence":"high"},"genre":{"broad":"한시","form":"칠언절구"},"sourceWork":{"collectionTitle":"동국이상국집","juan":null,"entryTitle":"江上曉雨","sourceUrl":"https://ko.wikisource.org/wiki/%EA%B0%95%EC%83%81%ED%9A%A8%EC%9A%B0","sourcePolicyId":"SRC-WIKISOURCE-TEXT"},"text":{"poemZh":"江岸人歸白鷺飛\n漁翁日暮得魚歸\n輕雲薄薄那成雨\n海氣干天偶作霖","poemKoReading":"강안인귀백로비\n어옹일모득어귀\n경운박박나성우\n해기간천우작림","poemKoGloss":null},"legacyAssets":{"translationKo":null,"notes":[],"commentaryKo":null},"ownedAssets":{"translationKoOwned":"강 언덕 사람 돌아가고 흰 해오라기 날아오르며\n어부는 날 저물어 잡은 고기 안고 돌아오네\n엷디엷은 구름 어찌 비를 이루랴마는\n바다 기운 하늘에 닿아 문득 큰비를 이루었네","notesOwned":[{"head":"海氣","body":"바다에서 올라오는 습한 기운을 뜻한다."}],"commentaryKoOwned":"강가의 생활 풍경과 기상 변화가 한 장면에 압축되어 있다.","ownedContentMeta":{"status":"mixed-test","editedBy":"태훈","reviewedBy":null,"approvedBy":null,"updatedAt":"2026-04-20 17:35","researchBacked":true,"needsHumanReview":true,"generationPolicy":"manual-mixed-batch","sourceRefs":["https://ko.wikisource.org/wiki/%EA%B0%95%EC%83%81%ED%9A%A8%EC%9A%B0"],"rightsReview":{"legacyTranslationInjectedToModel":false,"legacyNotesInjectedToModel":false,"similarityCheckPassed":true,"copyrightRiskLevel":"low","commercialSafe":true,"commercialSafeReason":"owned translation only"}}},"rights":{"originalText":{"exists":true,"sourcePolicyId":"SRC-WIKISOURCE-TEXT","sourceUrl":"https://ko.wikisource.org/wiki/%EA%B0%95%EC%83%81%ED%9A%A8%EC%9A%B0","copyrightStatus":"licensed","usageClass":"commercial_allowed","publicDisplayAllowedNow":true,"commercialAllowedNow":true,"requiresPermissionForCommercial":false,"mustReplaceBeforeCommercial":false,"replacementPriority":"low","attributionRequired":true,"checkedAt":null,"checkedBy":null,"evidence":null,"notes":null},"legacyTranslation":{"exists":false,"sourcePolicyId":null,"sourceUrl":null,"copyrightStatus":"unknown","usageClass":"not_applicable","publicDis